question,answer
"What is this platform about?","This is a social media platform for connecting users and sharing content."
"How do I post something?","Go to the home page and click the plus icon to post."
"Can I change my profile picture?","Yes, go to your profile settings to change your picture."
"hello?","hello! how can i assist you today."
"Hi, I'm building a social media app. Can you help me with some questions?","Of course! I'd be happy to help. What's on your mind."
"What features should I prioritize for a social media app?","Consider prioritizing features like user profiles, newsfeed, posting (text, images, videos), commenting, liking, and sharing. Also, think about user authentication, notification systems, and content moderation."
"How can I ensure user data privacy and security?"," Implement robust data encryption, secure authentication protocols (e.g., OAuth), and comply with data protection regulations (e.g., GDPR, CCPA). Regularly update and patch your app to prevent vulnerabilities."
"How are you?,"I'm just a bot,but I'm here to help you!."
"Who created you?","I was built by a developer using Python and Django! my Creators name is Akshay Aneesh and Abhishek Manoj"
"What is your name?","I'm your virtual assistant chatbot."
"Tell me a joke,Why don’t programmers like nature?", "It has too many bugs!"
"What is Django?","Django is a high-level Python web framework that encourages rapid development and clean, pragmatic design."
"What is Python?","Python is a popular programming language known for its readability and simplicity."
"How can I reset my password?","You can reset your password from your account settings or click "Forgot Password" on the login page."
"Where can I find my messages?","You can view your messages from the Messages section in the sidebar."
"Thanks","You're welcome!"
"Bye","Goodbye! Have a great day!"